{
    "$id": "https://raw.githubusercontent.com/BambusControl/obsidian-unicode-search/0.7.4/resources/save-data-schema.json",
    "$schema": "http://json-schema.org/draft-07/schema#",
    "definitions": {
        "BlockFilter": {
            "allOf": [
                {
                    "$ref": "https://raw.githubusercontent.com/BambusControl/obsidian-unicode-search/0.7.4/resources/save-data-schema.json#/definitions/CodePointInterval"
                },
                {
                    "$ref": "https://raw.githubusercontent.com/BambusControl/obsidian-unicode-search/0.7.4/resources/save-data-schema.json#/definitions/InclusionFlag"
                }
            ],
            "description": "Block of Unicode CodePoints"
        },
        "CategoryFilter": {
            "description": "Filter for a single category.",
            "properties": {
                "abbreviation": {
                    "$ref": "https://raw.githubusercontent.com/BambusControl/obsidian-unicode-search/0.7.4/resources/save-data-schema.json#/definitions/CharacterCategoryType",
                    "description": "Two-letter abbreviation of the category."
                },
                "included": {
                    "description": "Indicates whether a character is included in search or not",
                    "type": "boolean"
                }
            },
            "required": [
                "abbreviation",
                "included"
            ],
            "type": "object"
        },
        "CategoryGroupFilter": {
            "description": "Filters for a group of categories.",
            "properties": {
                "abbreviation": {
                    "$ref": "https://raw.githubusercontent.com/BambusControl/obsidian-unicode-search/0.7.4/resources/save-data-schema.json#/definitions/CharacterCategoryGroupType",
                    "description": "Single letter abbreviation of the category group."
                },
                "categories": {
                    "description": "Categories which belong to the group.",
                    "items": {
                        "$ref": "https://raw.githubusercontent.com/BambusControl/obsidian-unicode-search/0.7.4/resources/save-data-schema.json#/definitions/CategoryFilter"
                    },
                    "type": "array"
                }
            },
            "required": [
                "abbreviation",
                "categories"
            ],
            "type": "object"
        },
        "Character": {
            "allOf": [
                {
                    "$ref": "https://raw.githubusercontent.com/BambusControl/obsidian-unicode-search/0.7.4/resources/save-data-schema.json#/definitions/CodePointKey"
                },
                {
                    "$ref": "https://raw.githubusercontent.com/BambusControl/obsidian-unicode-search/0.7.4/resources/save-data-schema.json#/definitions/CodePointAttribute"
                }
            ],
            "description": "Unicode character representation throughout the plugin"
        },
        "CharacterCategoryGroupType": {
            "enum": [
                "C",
                "L",
                "M",
                "N",
                "P",
                "S",
                "Z"
            ],
            "type": "string"
        },
        "CharacterCategoryType": {
            "enum": [
                "Cc",
                "Cf",
                "Cn",
                "Co",
                "Cs",
                "Ll",
                "Lm",
                "Lo",
                "Lt",
                "Lu",
                "Mc",
                "Me",
                "Mn",
                "Nd",
                "Nl",
                "No",
                "Pc",
                "Pd",
                "Pe",
                "Pf",
                "Pi",
                "Po",
                "Ps",
                "Sc",
                "Sk",
                "Sm",
                "So",
                "Zl",
                "Zp",
                "Zs"
            ],
            "type": "string"
        },
        "CharacterChunk": {
            "description": "Downloaded Unicode Character Database",
            "properties": {
                "codePoints": {
                    "description": "CodePoints downloaded from the Unicode Character Database",
                    "items": {
                        "$ref": "https://raw.githubusercontent.com/BambusControl/obsidian-unicode-search/0.7.4/resources/save-data-schema.json#/definitions/Character"
                    },
                    "type": "array"
                },
                "initialized": {
                    "type": "boolean"
                },
                "version": {
                    "$ref": "https://raw.githubusercontent.com/BambusControl/obsidian-unicode-search/0.7.4/resources/save-data-schema.json#/definitions/SaveDataVersion"
                }
            },
            "required": [
                "codePoints",
                "initialized",
                "version"
            ],
            "type": "object"
        },
        "CodePointAttribute": {
            "description": "General attributes of a Unicode code point",
            "properties": {
                "category": {
                    "description": "Unicode General Category abbreviation",
                    "type": "string"
                },
                "glyph": {
                    "description": "The JavaScript string representation, NFC-normalised",
                    "minLength": 1,
                    "type": "string"
                },
                "name": {
                    "description": "Unicode name of the character",
                    "type": "string"
                }
            },
            "required": [
                "category",
                "glyph",
                "name"
            ],
            "type": "object"
        },
        "CodePointInterval": {
            "description": "Represents a closed interval/range of Unicode Code Points",
            "properties": {
                "end": {
                    "type": "number"
                },
                "start": {
                    "type": "number"
                }
            },
            "required": [
                "end",
                "start"
            ],
            "type": "object"
        },
        "CodePointKey": {
            "description": "Universally used key for a Unicode code point",
            "properties": {
                "id": {
                    "description": "The numeric address in the Unicode code space",
                    "type": "number"
                }
            },
            "required": [
                "id"
            ],
            "type": "object"
        },
        "Favorite": {
            "description": "Raw favorite information, as stored in save data",
            "properties": {
                "added": {
                    "description": "Date when the codePoint was added to favorites",
                    "type": "string"
                },
                "quickInsertEnabled": {
                    "description": "Whether the codePoint has a quickInsertEnabled command",
                    "type": "boolean"
                }
            },
            "required": [
                "added",
                "quickInsertEnabled"
            ],
            "type": "object"
        },
        "FavoriteChunk": {
            "description": "Users favorite codePoints",
            "properties": {
                "codePoints": {
                    "description": "List of favorite codePoints",
                    "items": {
                        "$ref": "https://raw.githubusercontent.com/BambusControl/obsidian-unicode-search/0.7.4/resources/save-data-schema.json#/definitions/RawCodePointFavorite"
                    },
                    "type": "array"
                },
                "initialized": {
                    "type": "boolean"
                },
                "version": {
                    "$ref": "https://raw.githubusercontent.com/BambusControl/obsidian-unicode-search/0.7.4/resources/save-data-schema.json#/definitions/SaveDataVersion"
                }
            },
            "required": [
                "codePoints",
                "initialized",
                "version"
            ],
            "type": "object"
        },
        "InclusionFlag": {
            "description": "A flag indicating whether a character is included in search or not",
            "properties": {
                "included": {
                    "description": "Indicates whether a character is included in search or not",
                    "type": "boolean"
                }
            },
            "required": [
                "included"
            ],
            "type": "object"
        },
        "MetaChunk": {
            "description": "Meta information for the datastore",
            "properties": {
                "events": {
                    "description": "A collection of unique data events.",
                    "items": {
                        "const": "download_characters",
                        "type": "string"
                    },
                    "type": "array"
                },
                "initialized": {
                    "type": "boolean"
                },
                "pluginVersion": {
                    "$ref": "https://raw.githubusercontent.com/BambusControl/obsidian-unicode-search/0.7.4/resources/save-data-schema.json#/definitions/PluginVersion",
                    "description": "Latest used version of the plugin which used this data"
                },
                "version": {
                    "$ref": "https://raw.githubusercontent.com/BambusControl/obsidian-unicode-search/0.7.4/resources/save-data-schema.json#/definitions/SaveDataVersion"
                }
            },
            "required": [
                "events",
                "initialized",
                "pluginVersion",
                "version"
            ],
            "type": "object"
        },
        "PlaneFilter": {
            "description": "Unicode Plane of Unicode Blocks",
            "properties": {
                "blocks": {
                    "description": "Filter criteria for blocks of Unicode characters",
                    "items": {
                        "$ref": "https://raw.githubusercontent.com/BambusControl/obsidian-unicode-search/0.7.4/resources/save-data-schema.json#/definitions/BlockFilter"
                    },
                    "type": "array"
                },
                "end": {
                    "type": "number"
                },
                "start": {
                    "type": "number"
                }
            },
            "required": [
                "blocks",
                "end",
                "start"
            ],
            "type": "object"
        },
        "PluginVersion": {
            "description": "Version of the plugin.\n\nMust comply with RegEx:\n```^[0-9]+\\\\.[0-9]+\\\\.[0-9]+(?:-[A-Z]+)?$```",
            "enum": [
                "0.2.0",
                "0.2.1",
                "0.2.2",
                "0.2.3",
                "0.3.0",
                "0.4.0",
                "0.4.1",
                "0.5.0",
                "0.6.0",
                "0.6.1",
                "0.7.0",
                "0.7.1",
                "0.7.2",
                "0.7.3",
                "0.7.4"
            ],
            "type": "string"
        },
        "PoolChunk": {
            "description": "User saved character filters",
            "properties": {
                "initialized": {
                    "type": "boolean"
                },
                "unicode": {
                    "$ref": "https://raw.githubusercontent.com/BambusControl/obsidian-unicode-search/0.7.4/resources/save-data-schema.json#/definitions/UnicodeFilter",
                    "description": "Filter criteria for Unicode characters"
                },
                "version": {
                    "$ref": "https://raw.githubusercontent.com/BambusControl/obsidian-unicode-search/0.7.4/resources/save-data-schema.json#/definitions/SaveDataVersion"
                }
            },
            "required": [
                "initialized",
                "unicode",
                "version"
            ],
            "type": "object"
        },
        "RawCodePointFavorite": {
            "allOf": [
                {
                    "$ref": "https://raw.githubusercontent.com/BambusControl/obsidian-unicode-search/0.7.4/resources/save-data-schema.json#/definitions/CodePointKey"
                },
                {
                    "$ref": "https://raw.githubusercontent.com/BambusControl/obsidian-unicode-search/0.7.4/resources/save-data-schema.json#/definitions/Favorite"
                }
            ],
            "description": "Favorite information of a specific codePoint as stored in save data"
        },
        "RawCodePointUse": {
            "allOf": [
                {
                    "$ref": "https://raw.githubusercontent.com/BambusControl/obsidian-unicode-search/0.7.4/resources/save-data-schema.json#/definitions/CodePointKey"
                },
                {
                    "$ref": "https://raw.githubusercontent.com/BambusControl/obsidian-unicode-search/0.7.4/resources/save-data-schema.json#/definitions/RawUseRecord"
                }
            ],
            "description": "Usage information of a specific codePoint as stored in save data"
        },
        "RawUseRecord": {
            "description": "Raw usage information, as stored in save data",
            "properties": {
                "firstUse": {
                    "description": "Alias to hint that a string is a date string",
                    "type": "string"
                },
                "lastUse": {
                    "description": "Alias to hint that a string is a date string",
                    "type": "string"
                },
                "timesUsed": {
                    "type": "number"
                }
            },
            "required": [
                "firstUse",
                "lastUse",
                "timesUsed"
            ],
            "type": "object"
        },
        "SaveDataVersion": {
            "description": "Version of the save data schema.\n\nMust comply with RegEx:\n```^[0-9]+\\\\.[0-9]+\\\\.[0-9]+(?:-[A-Z]+)?$```\n\nThe version of the save data schema is independent of the plugin version",
            "enum": [
                "0.4.0",
                "0.5.0",
                "0.6.0",
                "0.7.0"
            ],
            "type": "string"
        },
        "UnicodeFilter": {
            "description": "User set filter data for Unicode characters.",
            "properties": {
                "categoryGroups": {
                    "description": "Filter criteria for category groups of Unicode characters",
                    "items": {
                        "$ref": "https://raw.githubusercontent.com/BambusControl/obsidian-unicode-search/0.7.4/resources/save-data-schema.json#/definitions/CategoryGroupFilter"
                    },
                    "type": "array"
                },
                "planes": {
                    "description": "Filter criteria for planes of Unicode characters",
                    "items": {
                        "$ref": "https://raw.githubusercontent.com/BambusControl/obsidian-unicode-search/0.7.4/resources/save-data-schema.json#/definitions/PlaneFilter"
                    },
                    "type": "array"
                }
            },
            "required": [
                "categoryGroups",
                "planes"
            ],
            "type": "object"
        },
        "UseHistoryChunk": {
            "description": "User generated usage data",
            "properties": {
                "codePoints": {
                    "description": "Statistics of the individual codePoint usage",
                    "items": {
                        "$ref": "https://raw.githubusercontent.com/BambusControl/obsidian-unicode-search/0.7.4/resources/save-data-schema.json#/definitions/RawCodePointUse"
                    },
                    "type": "array"
                },
                "initialized": {
                    "type": "boolean"
                },
                "version": {
                    "$ref": "https://raw.githubusercontent.com/BambusControl/obsidian-unicode-search/0.7.4/resources/save-data-schema.json#/definitions/SaveDataVersion"
                }
            },
            "required": [
                "codePoints",
                "initialized",
                "version"
            ],
            "type": "object"
        }
    },
    "description": "Structure of `data.json`, where each fragment is a self-managed data fragment",
    "properties": {
        "characters": {
            "$ref": "https://raw.githubusercontent.com/BambusControl/obsidian-unicode-search/0.7.4/resources/save-data-schema.json#/definitions/CharacterChunk",
            "description": "Local character database"
        },
        "favorites": {
            "$ref": "https://raw.githubusercontent.com/BambusControl/obsidian-unicode-search/0.7.4/resources/save-data-schema.json#/definitions/FavoriteChunk",
            "description": "Favorites saved manually by the user"
        },
        "meta": {
            "$ref": "https://raw.githubusercontent.com/BambusControl/obsidian-unicode-search/0.7.4/resources/save-data-schema.json#/definitions/MetaChunk",
            "description": "Metadata information about the save data itself"
        },
        "pool": {
            "$ref": "https://raw.githubusercontent.com/BambusControl/obsidian-unicode-search/0.7.4/resources/save-data-schema.json#/definitions/PoolChunk",
            "description": "User's character pool configuration"
        },
        "useHistory": {
            "$ref": "https://raw.githubusercontent.com/BambusControl/obsidian-unicode-search/0.7.4/resources/save-data-schema.json#/definitions/UseHistoryChunk",
            "description": "User insertion history"
        }
    },
    "required": [
        "characters",
        "favorites",
        "meta",
        "pool",
        "useHistory"
    ],
    "type": "object"
}

