{
  "meta": {
    "initialized": true,
    "version": "0.7.0",
    "pluginVersion": "0.7.4",
    "events": []
  },
  "pool": {
    "initialized": true,
    "version": "0.7.0",
    "unicode": {
      "planes": [
        {
          "start": 0,
          "end": 65535,
          "blocks": [
            {
              "start": 0,
              "end": 127,
              "included": true
            },
            {
              "start": 128,
              "end": 255,
              "included": true
            },
            {
              "start": 256,
              "end": 383,
              "included": true
            },
            {
              "start": 384,
              "end": 591,
              "included": true
            },
            {
              "start": 592,
              "end": 687,
              "included": true
            },
            {
              "start": 688,
              "end": 767,
              "included": true
            },
            {
              "start": 768,
              "end": 879,
              "included": true
            },
            {
              "start": 880,
              "end": 1023,
              "included": true
            },
            {
              "start": 1024,
              "end": 1279,
              "included": true
            },
            {
              "start": 1280,
              "end": 1327,
              "included": true
            },
            {
              "start": 1328,
              "end": 1423,
              "included": true
            },
            {
              "start": 1424,
              "end": 1535,
              "included": true
            },
            {
              "start": 1536,
              "end": 1791,
              "included": true
            },
            {
              "start": 1792,
              "end": 1871,
              "included": true
            },
            {
              "start": 1872,
              "end": 1919,
              "included": true
            },
            {
              "start": 1920,
              "end": 1983,
              "included": true
            },
            {
              "start": 1984,
              "end": 2047,
              "included": true
            },
            {
              "start": 2048,
              "end": 2111,
              "included": true
            },
            {
              "start": 2112,
              "end": 2143,
              "included": true
            },
            {
              "start": 2144,
              "end": 2159,
              "included": true
            },
            {
              "start": 2160,
              "end": 2207,
              "included": true
            },
            {
              "start": 2208,
              "end": 2303,
              "included": true
            },
            {
              "start": 2304,
              "end": 2431,
              "included": true
            },
            {
              "start": 2432,
              "end": 2559,
              "included": true
            },
            {
              "start": 2560,
              "end": 2687,
              "included": true
            },
            {
              "start": 2688,
              "end": 2815,
              "included": true
            },
            {
              "start": 2816,
              "end": 2943,
              "included": true
            },
            {
              "start": 2944,
              "end": 3071,
              "included": true
            },
            {
              "start": 3072,
              "end": 3199,
              "included": true
            },
            {
              "start": 3200,
              "end": 3327,
              "included": true
            },
            {
              "start": 3328,
              "end": 3455,
              "included": true
            },
            {
              "start": 3456,
              "end": 3583,
              "included": true
            },
            {
              "start": 3584,
              "end": 3711,
              "included": true
            },
            {
              "start": 3712,
              "end": 3839,
              "included": true
            },
            {
              "start": 3840,
              "end": 4095,
              "included": true
            },
            {
              "start": 4096,
              "end": 4255,
              "included": true
            },
            {
              "start": 4256,
              "end": 4351,
              "included": true
            },
            {
              "start": 4352,
              "end": 4607,
              "included": true
            },
            {
              "start": 4608,
              "end": 4991,
              "included": true
            },
            {
              "start": 4992,
              "end": 5023,
              "included": true
            },
            {
              "start": 5024,
              "end": 5119,
              "included": true
            },
            {
              "start": 5120,
              "end": 5759,
              "included": true
            },
            {
              "start": 5760,
              "end": 5791,
              "included": true
            },
            {
              "start": 5792,
              "end": 5887,
              "included": true
            },
            {
              "start": 5888,
              "end": 5919,
              "included": true
            },
            {
              "start": 5920,
              "end": 5951,
              "included": true
            },
            {
              "start": 5952,
              "end": 5983,
              "included": true
            },
            {
              "start": 5984,
              "end": 6015,
              "included": true
            },
            {
              "start": 6016,
              "end": 6143,
              "included": true
            },
            {
              "start": 6144,
              "end": 6319,
              "included": true
            },
            {
              "start": 6320,
              "end": 6399,
              "included": true
            },
            {
              "start": 6400,
              "end": 6479,
              "included": true
            },
            {
              "start": 6480,
              "end": 6527,
              "included": true
            },
            {
              "start": 6528,
              "end": 6623,
              "included": true
            },
            {
              "start": 6624,
              "end": 6655,
              "included": true
            },
            {
              "start": 6656,
              "end": 6687,
              "included": true
            },
            {
              "start": 6688,
              "end": 6831,
              "included": true
            },
            {
              "start": 6832,
              "end": 6911,
              "included": true
            },
            {
              "start": 6912,
              "end": 7039,
              "included": true
            },
            {
              "start": 7040,
              "end": 7103,
              "included": true
            },
            {
              "start": 7104,
              "end": 7167,
              "included": true
            },
            {
              "start": 7168,
              "end": 7247,
              "included": true
            },
            {
              "start": 7248,
              "end": 7295,
              "included": true
            },
            {
              "start": 7296,
              "end": 7311,
              "included": true
            },
            {
              "start": 7312,
              "end": 7359,
              "included": true
            },
            {
              "start": 7360,
              "end": 7375,
              "included": true
            },
            {
              "start": 7376,
              "end": 7423,
              "included": true
            },
            {
              "start": 7424,
              "end": 7551,
              "included": true
            },
            {
              "start": 7552,
              "end": 7615,
              "included": true
            },
            {
              "start": 7616,
              "end": 7679,
              "included": true
            },
            {
              "start": 7680,
              "end": 7935,
              "included": true
            },
            {
              "start": 7936,
              "end": 8191,
              "included": true
            },
            {
              "start": 8192,
              "end": 8303,
              "included": true
            },
            {
              "start": 8304,
              "end": 8351,
              "included": true
            },
            {
              "start": 8352,
              "end": 8399,
              "included": true
            },
            {
              "start": 8400,
              "end": 8447,
              "included": true
            },
            {
              "start": 8448,
              "end": 8527,
              "included": true
            },
            {
              "start": 8528,
              "end": 8591,
              "included": true
            },
            {
              "start": 8592,
              "end": 8703,
              "included": true
            },
            {
              "start": 8704,
              "end": 8959,
              "included": true
            },
            {
              "start": 8960,
              "end": 9215,
              "included": true
            },
            {
              "start": 9216,
              "end": 9279,
              "included": true
            },
            {
              "start": 9280,
              "end": 9311,
              "included": true
            },
            {
              "start": 9312,
              "end": 9471,